<?xml version="1.0" encoding="UTF-8"?>
<StartingTag xmlns:xsi="http://www.w3.org/2001/XMLSchema-instance" xsi:noNamespaceSchemaLocation="SampleBondsXSD_Short.xsd">
  <Instrument>
    <instrumentId>10</instrumentId>
    <datasetId>0</datasetId>
    <version>0</version>
    <newIssue>newIssue</newIssue>
    <instrumentGrade>instrumentGrade</instrumentGrade>
    <lastModifiedDate>2001-12-31T12:00:00</lastModifiedDate>
    <source>source</source>
    <amtIssuedPublic>0.0</amtIssuedPublic>
    <isBondLinked>true</isBondLinked>
    <benchmarkISIN>ISIN</benchmarkISIN>
    <businessDayConvention>businessDayConvention</businessDayConvention>
    <classification>classification</classification>
    <classificationSubType>classificationSubType</classificationSubType>
    <priceAtIssue>0.0</priceAtIssue>
    <issueSize>0.0</issueSize>
    <issueCountry>USD</issueCountry>
    <issueDate>2001-01-01</issueDate>
    <issueName>issueName</issueName>
    <issueType>issueType</issueType>
    <lastCouponDate>2001-01-01</lastCouponDate>
    <marketRegion>marketRegion</marketRegion>
    <maturityAmount>0.0</maturityAmount>
    <maturityDate>2001-01-01</maturityDate>
    <maturityPrice>0.0</maturityPrice>
    <assetExchange>
      <assetExchangeSource>assetExchangeSource</assetExchangeSource>
      <exchangeCode>exchangeCode</exchangeCode>
      <mic>MI</mic>
      <micStatus>true</micStatus>
      <listingEffectiveDate>2001-01-01</listingEffectiveDate>
      <bbgExchangeId>bbgExchangeId</bbgExchangeId>
      <bbgExchangeTicker>bbgExchangeTicker</bbgExchangeTicker>
      <cityOfListing>cityOfListing</cityOfListing>
      <countryOfListing>USD</countryOfListing>
      <delistingDate>2001-01-01</delistingDate>
      <exchangeName>exchangeName</exchangeName>
      <listingStatus>listingStatus</listingStatus>
      <isPrimaryListing>true</isPrimaryListing>
      <cityOfSubMarket>cityOfSubMarket</cityOfSubMarket>
      <subMarketExchange>subMarketExchange</subMarketExchange>
      <subMarketMic>MIC</subMarketMic>
      <subMarketMicStatus>subMarketMicStatus</subMarketMicStatus>
    </assetExchange>
    <CallSchedule>
      <callScheduleSource>callScheduleSource</callScheduleSource>
      <isCallDefeased>true</isCallDefeased>
      <callStartDate>2001-01-01</callStartDate>
      <callEndDate>2001-01-01</callEndDate>
      <callValidity>0</callValidity>
      <callFrequencyCode>callFrequencyCode</callFrequencyCode>
      <callPrice>0.0</callPrice>
      <callMaxNoticeDays>0</callMaxNoticeDays>
      <callMinNoticeDays>0</callMinNoticeDays>
      <isCompoundAccretedValue>true</isCompoundAccretedValue>
      <makewholeSpread>0.0</makewholeSpread>
      <softCallConversionPercent>0.0</softCallConversionPercent>
      <softCallConversionPercentPremium>0.0</softCallConversionPercentPremium>
      <softCallDays>0.0</softCallDays>
      <softCallTriggerValue>0.0</softCallTriggerValue>
    </CallSchedule>
    <PutSchedule>
      <putScheduleSource>putScheduleSource</putScheduleSource>
      <putStartDate>2001-01-01</putStartDate>
      <putEndDate>2001-01-01</putEndDate>
      <putValidity>0</putValidity>
      <putFee>0.0</putFee>
      <putFrequencyCode>putFrequencyCode</putFrequencyCode>
      <putPrice>0.0</putPrice>
      <isSpecialPut>true</isSpecialPut>
      <putMaxNoticeDays>0</putMaxNoticeDays>
      <putMinNoticeDays>0</putMinNoticeDays>
      <putNoticeDaysConvention>putNoticeDaysConvention</putNoticeDaysConvention>
    </PutSchedule>
    <Ratings>
      <ratingType>ratingType</ratingType>
      <ratingProvider>ratingProvider</ratingProvider>
      <ratingEffectiveDate>2001-01-01</ratingEffectiveDate>
      <rating>rating</rating>
      <ratingsSource>ratingsSource</ratingsSource>
      <ratingOutlook>ratingOutlook</ratingOutlook>
      <ratingWatch>ratingWatch</ratingWatch>
      <ratingEndDate>2001-01-01</ratingEndDate>
      <isIssuerOrInstrumentRating>AA</isIssuerOrInstrumentRating>
    </Ratings>
    <Redemption>
      <redemptionSource>redemptionSource</redemptionSource>
      <amount>0.0</amount>
      <redemptionMethod>redemptionMethod</redemptionMethod>
      <redemptionStrikePrice>0.0</redemptionStrikePrice>
      <redemptionValue>0.0</redemptionValue>
      <redenominatedExchangeRate>0.0</redenominatedExchangeRate>
      <refundingDatedDate>2001-01-01</refundingDatedDate>
      <refundingSettleDate>2001-01-01</refundingSettleDate>
      <currAmtOutstandingEffectiveDate>2001-01-01</currAmtOutstandingEffectiveDate>
      <redemptionCashFlow>0.0</redemptionCashFlow>
      <reofferReopenPrice>0.0</reofferReopenPrice>
      <reofferReopenSpread>0.0</reofferReopenSpread>
      <reofferReopenYield>0.0</reofferReopenYield>
      <caAnnouncementDate>2001-01-01</caAnnouncementDate>
      <amountOutstanding>0.0</amountOutstanding>
    </Redemption>
  </Instrument>
  <Instrument>
    <instrumentId>11</instrumentId>
    <datasetId>0</datasetId>
    <version>0</version>
    <newIssue>newIssue</newIssue>
    <instrumentGrade>instrumentGrade</instrumentGrade>
    <lastModifiedDate>2001-12-31T12:00:00</lastModifiedDate>
    <source>source</source>
    <amtIssuedPublic>0.0</amtIssuedPublic>
    <isBondLinked>true</isBondLinked>
    <benchmarkISIN>ISIN</benchmarkISIN>
    <businessDayConvention>businessDayConvention</businessDayConvention>
    <classification>classification</classification>
    <classificationSubType>classificationSubType</classificationSubType>
    <priceAtIssue>0.0</priceAtIssue>
    <issueSize>0.0</issueSize>
    <issueCountry>USD</issueCountry>
    <issueDate>2001-01-01</issueDate>
    <issueName>issueName</issueName>
    <issueType>issueType</issueType>
    <lastCouponDate>2001-01-01</lastCouponDate>
    <marketRegion>marketRegion</marketRegion>
    <maturityAmount>0.0</maturityAmount>
    <maturityDate>2001-01-01</maturityDate>
    <maturityPrice>0.0</maturityPrice>
    <assetExchange>
      <assetExchangeSource>assetExchangeSource</assetExchangeSource>
      <exchangeCode>exchangeCode</exchangeCode>
      <mic>MI</mic>
      <micStatus>true</micStatus>
      <listingEffectiveDate>2001-01-01</listingEffectiveDate>
      <bbgExchangeId>bbgExchangeId</bbgExchangeId>
      <bbgExchangeTicker>bbgExchangeTicker</bbgExchangeTicker>
      <cityOfListing>cityOfListing</cityOfListing>
      <countryOfListing>USD</countryOfListing>
      <delistingDate>2001-01-01</delistingDate>
      <exchangeName>exchangeName</exchangeName>
      <listingStatus>listingStatus</listingStatus>
      <isPrimaryListing>true</isPrimaryListing>
      <cityOfSubMarket>cityOfSubMarket</cityOfSubMarket>
      <subMarketExchange>subMarketExchange</subMarketExchange>
      <subMarketMic>MIC</subMarketMic>
      <subMarketMicStatus>subMarketMicStatus</subMarketMicStatus>
    </assetExchange>
    <CallSchedule>
      <callScheduleSource>callScheduleSource</callScheduleSource>
      <isCallDefeased>true</isCallDefeased>
      <callStartDate>2001-01-01</callStartDate>
      <callEndDate>2001-01-01</callEndDate>
      <callValidity>0</callValidity>
      <callFrequencyCode>callFrequencyCode</callFrequencyCode>
      <callPrice>0.0</callPrice>
      <callMaxNoticeDays>0</callMaxNoticeDays>
      <callMinNoticeDays>0</callMinNoticeDays>
      <isCompoundAccretedValue>true</isCompoundAccretedValue>
      <makewholeSpread>0.0</makewholeSpread>
      <softCallConversionPercent>0.0</softCallConversionPercent>
      <softCallConversionPercentPremium>0.0</softCallConversionPercentPremium>
      <softCallDays>0.0</softCallDays>
      <softCallTriggerValue>0.0</softCallTriggerValue>
    </CallSchedule>
    <PutSchedule>
      <putScheduleSource>putScheduleSource</putScheduleSource>
      <putStartDate>2001-01-01</putStartDate>
      <putEndDate>2001-01-01</putEndDate>
      <putValidity>0</putValidity>
      <putFee>0.0</putFee>
      <putFrequencyCode>putFrequencyCode</putFrequencyCode>
      <putPrice>0.0</putPrice>
      <isSpecialPut>true</isSpecialPut>
      <putMaxNoticeDays>0</putMaxNoticeDays>
      <putMinNoticeDays>0</putMinNoticeDays>
      <putNoticeDaysConvention>putNoticeDaysConvention</putNoticeDaysConvention>
    </PutSchedule>
    <Ratings>
      <ratingType>ratingType</ratingType>
      <ratingProvider>ratingProvider</ratingProvider>
      <ratingEffectiveDate>2001-01-01</ratingEffectiveDate>
      <rating>rating</rating>
      <ratingsSource>ratingsSource</ratingsSource>
      <ratingOutlook>ratingOutlook</ratingOutlook>
      <ratingWatch>ratingWatch</ratingWatch>
      <ratingEndDate>2001-01-01</ratingEndDate>
      <isIssuerOrInstrumentRating>AA</isIssuerOrInstrumentRating>
    </Ratings>
    <Redemption>
      <redemptionSource>redemptionSource</redemptionSource>
      <amount>0.0</amount>
      <redemptionMethod>redemptionMethod</redemptionMethod>
      <redemptionStrikePrice>0.0</redemptionStrikePrice>
      <redemptionValue>0.0</redemptionValue>
      <redenominatedExchangeRate>0.0</redenominatedExchangeRate>
      <refundingDatedDate>2001-01-01</refundingDatedDate>
      <refundingSettleDate>2001-01-01</refundingSettleDate>
      <currAmtOutstandingEffectiveDate>2001-01-01</currAmtOutstandingEffectiveDate>
      <redemptionCashFlow>0.0</redemptionCashFlow>
      <reofferReopenPrice>0.0</reofferReopenPrice>
      <reofferReopenSpread>0.0</reofferReopenSpread>
      <reofferReopenYield>0.0</reofferReopenYield>
      <caAnnouncementDate>2001-01-01</caAnnouncementDate>
      <amountOutstanding>0.0</amountOutstanding>
    </Redemption>
  </Instrument>  
</StartingTag>
